Product Name,Website / Pricing,Brand name,Wyz Categories,G2 Category,G2 SubCategory,Utilisation Type,Plan Type ,Resource ,Top 5 Use Case of the Application,RFQ,,,,More Details from Customer,,,
,,,,,,,,,,Pricing Levers,Payment Frequency,Pricing (INR),Implementations,,,,
Confluence,https://www.atlassian.com/software/confluence,Atlassian,DW - Productivity Tools,Knowledge Management Software,Knowledge Base Software,Per Seat,Free,"https://www.atlassian.com/software/confluence/pricing
","1. Knowledge Hub: Confluence is where we store guides, FAQs, and team knowledge. It helps us onboard new members smoothly and keeps all information easy to find.

2. Project Collaboration: Confluence is used to plan projects, track progress, and manage tasks together. It keeps project documents organized and everyone on the same page.

3. Meeting Notes: Confluence captures meeting notes and decisions in one place. It ensures everyone know what was discussed and what actions to take next.

4. Team Portals: Each team has a portal in Confluence where we they can share updates, goals, and important resources. 

5. Agile Support: For Agile projects, Confluence helps document requirements, user stories, and sprint plans. Integrated with Jira, it keeps our development process smooth and efficient.",". User Count: The price scales based on how many people will use Confluence.
   
. Deployment Choice: Choose between Cloud (hosted by Atlassian) or Data Center (self-hosted) options, affecting pricing.
   
. Subscription Type: Pay monthly or annually, with annual plans often offering savings.
   
. Apps and Features: Additional costs may apply for extra features or apps from the Atlassian Marketplace.
   
. Support Level: Different support tiers (Standard vs. Premium) are available, influencing pricing and service levels.","Monthly, Annually",$0,No ,"SEN Number
Registered email id with Atlassian",,,
Confluence,https://www.atlassian.com/software/confluence,Atlassian,DW - Productivity Tools,Knowledge Management Software,Knowledge Base Software,Per Seat,Standard,,,,"Monthly, Annually",$6.05 / User / Month,No / Support,,,,
Confluence,https://www.atlassian.com/software/confluence,Atlassian,DW - Productivity Tools,Knowledge Management Software,Knowledge Base Software,Per Seat,Premium,,,,"Monthly, Annually",$11.55 / User / Month,No / Support,,,Common Questions,Sub Questions
Confluence,https://www.atlassian.com/software/confluence,Atlassian,DW - Productivity Tools,Knowledge Management Software,Knowledge Base Software,Per Seat,Enterprise,,,,"Monthly, Annually",Contact Sales,No / Support,,,New/Renewal,Renewal Time Line
Jira,https://www.atlassian.com/software/jira,Atlassian,DW - Productivity Tools,Product Management Software,,Per Seat,Free,"https://www.atlassian.com/software/jira/pricing
https://www.g2.com/products/jira/reviews
Chat GPT","1. Project Management: Jira helps us plan projects, track tasks, and manage team workloads effectively. It keeps everyone aligned and tasks organized.

2. Agile Development: We use Jira for Agile methodologies like Scrum and Kanban. It helps us manage sprints, user stories, and releases, ensuring we deliver software iteratively and on time.

3. Issue Tracking: Jira serves as a central hub for tracking bugs, issues, and feature requests. 

4. Custom Workflows: With Jira, we can create custom workflows tailored to our team's needs. This flexibility allows us to automate processes and streamline our work.

5. Reporting and Insights: Jira provides us with valuable insights through reporting and dashboards. It helps us analyze team performance, project progress, and make data-driven decisions.",". User Count: Pricing scales based on the number of users needing access to Jira.

. Deployment Options: Choose between Jira Cloud (hosted by Atlassian) or Jira Data Center (self-hosted), impacting features and scalability.

. Subscription Type: Flexible billing options include monthly or annual plans, with annual subscriptions often offering cost savings.

. Apps and Integrations: Additional costs may apply for apps and integrations available via the Atlassian Marketplace to extend Jira's functionality.

. Support Levels: Different support tiers (Standard vs. Premium) offer varying levels of assistance and response times.

","Monthly, Annually",$0,No ,,,,Purshase Price/ISV or Partner Quote
Jira,https://www.atlassian.com/software/jira,Atlassian,DW - Productivity Tools,Product Management Software,,Per Seat,Standard,,,,"Monthly, Annually",$8.15/ User / month,No / Support,,,,
Jira,https://www.atlassian.com/software/jira,Atlassian,DW - Productivity Tools,Product Management Software,,Per Seat,Premium,,,,"Monthly, Annually",$16 / User / month,No / Support,,,Number of Licences,Type of Licences
Jira,https://www.atlassian.com/software/jira,Atlassian,DW - Productivity Tools,Product Management Software,,Per Seat,Enterprise,,,,"Monthly, Annually",Contact Sales,No / Support,,,,
GitLab,https://about.gitlab.com/,GitLab,DW - Productivity Tools,DevOps Software,Version Control Hosting Software,Per Seat,Free,"https://about.gitlab.com/pricing/
https://www.g2.com/products/gitlab/reviews
https://www.devopsschool.com/blog/what-is-gitlab-and-use-cases-of-gitlab/
https://handbook.gitlab.com/handbook/company/pricing/","1. Version Control: Manage code versions efficiently, track changes, and revert to previous versions if needed.

2. Collaboration: Facilitate team collaboration through code reviews, issue tracking, and project boards.

3. Continuous Integration and Delivery (CI/CD): Automate building, testing, and deploying software for faster and more reliable releases.

4. Infrastructure as Code (IaC): Manage and automate your infrastructure configuration with tools like Terraform.

5. Security: Scan code for vulnerabilities, manage secrets securely, and protect your deployments from threats.

6. Project Management: Organize and track project progress with milestones, deadlines, and task management tools.

7. Documentation: Create and share documentation directly within your GitLab repository for easy access.

8. Remote Work: Facilitate communication and collaboration for teams working remotely.

9. Scalability: Accommodate projects of all sizes, from small startups to large enterprises.

10. Customization: Extend GitLab’s functionality with numerous integrations and plugins to tailor it to your specific needs.","
. Feature-Based Plans: GitLab offers different plans to match various needs and budgets. Whether you're a small team just starting out or a large enterprise needing advanced features, you can choose from the free, premium, or ultimate plans, each packed with progressively more robust features.

. Scalable User Pricing: As your team grows, GitLab’s pricing scales with you. The cost per user adjusts based on the number of users, often providing better rates for larger teams, making it easier to plan as you expand.

. Flexible Billing: You have the option to pay monthly or annually. Annual billing often comes with a discount, helping you save if you're ready to commit for the year. But if you prefer flexibility, monthly billing is available too.

. Customization with Add-Ons: Need something extra? GitLab allows you to add specific features or enhanced support to your plan. This means you can tailor your subscription to exactly what your team requires without paying for unnecessary extras.

. Competitive Pricing: GitLab keeps an eye on the market to ensure their pricing remains competitive. They regularly review and adjust their prices, ensuring you're getting great value compared to other options out there.
","Monthly, Annually",$0,Optional,,,,
GitLab,https://about.gitlab.com/,GitLab,DW - Productivity Tools,DevOps Software,Version Control Hosting Software,Per Seat,Premium,,,,,"$29 per user/month,
billed annually",Optional,,,Type of Billing,Frequency(Monthly/Annual/Quaterly)
GitLab,https://about.gitlab.com/,GitLab,DW - Productivity Tools,DevOps Software,Version Control Hosting Software,Per Seat,Ultimate,,,,,Contact Sales,Optional,,,,Currency(USD/INR)
GitHub,https://github.com/,Microsoft,DW - Productivity Tools,DevOps Software,Version Control Hosting Software,Per Seat,Free,"https://github.com/pricing
https://www.g2.com/products/github/reviews
Chat GPT",". Collaborative Software Development:
   Teams can work together on the same codebase, track changes, and manage contributions through pull requests, making it easy to collaborate from anywhere.

. Open Source Project Hosting:
   Developers can publish and share their code, allowing the global community to contribute, improve, and use it, fostering innovation and collaboration.

. Project Documentation:
   Use GitHub’s wikis and markdown files to create and maintain comprehensive project documentation, making it easy for new contributors to get up to speed.

. Version Control:
   Track changes to your code over time, revert to previous versions when necessary, and understand the history and evolution of your project.

. Automated Testing and Deployment:
   Integrate GitHub with CI/CD tools to automate the testing and deployment process, ensuring code quality and accelerating the release cycle.",". Collaborator Seats: Pricing based on the number of collaborators allowed per repository.
. Storage Limits: Different tiers with varying amounts of storage for repositories.
. Enterprise Support: Premium pricing for dedicated support and SLA (Service Level Agreement) guarantees.
. Extra cost for compliance features and regulatory certifications.
. Optional paid training sessions or onboarding services for teams.",Monthly,$0,No / Support,,,Commitment,Time Based
GitHub,https://github.com/,Microsoft,DW - Productivity Tools,DevOps Software,Version Control Hosting Software,Per Seat,Team ,,,,,$4 per user/month,No / Support,,,,Usage Based
GitHub,https://github.com/,Microsoft,DW - Productivity Tools,DevOps Software,Version Control Hosting Software,Per Seat,Enterprise,,,,,$21 per user/month,Optional for GitHub Enterprise Server,,,,Vendor Based
Atlas ,https://www.mongodb.com/atlas,Mongo DB,DPDT- Data & GenAi,Database Software,Database as a Service (DBaaS) Providers,Usage Based,Shared,"https://www.mongodb.com/pricing
https://www.g2.com/products/mongodb-atlas/pricing
Chat GPT","
. Scalable Web Applications: MongoDB Atlas is ideal for building scalable web applications due to its flexible data model and automatic scaling capabilities.

. Real-time Analytics: It supports real-time analytics by efficiently storing and querying large volumes of data, making it suitable for operational analytics and business intelligence.

. Mobile Applications: MongoDB Atlas provides seamless integration with mobile applications, offering offline synchronization and flexible data storage options.

. Internet of Things (IoT): It manages IoT data effectively with features like time-series data storage, enabling real-time data processing and analysis from connected devices.

. Content Management and Delivery: MongoDB Atlas powers content-rich applications and websites with its ability to store and serve unstructured data, manage metadata, and support content versioning.

","Instance Type: Pricing varies based on the type of MongoDB instance (shared or dedicated) and the specific configuration (e.g., CPU cores, RAM).

Instance Size: Costs increase with larger instance sizes, accommodating greater processing power and storage capacity.

Storage: Pricing is based on the amount of storage allocated to your databases, with additional costs for exceeding allocated storage limits.

Data Transfer: Charges apply for data transferred into and out of your MongoDB Atlas clusters, based on the volume of data transferred.

Backup and Restore: Automated backups are included, with options for point-in-time recovery and extended retention periods available at additional cost.",Monthly,$0,,,,,
Atlas ,https://www.mongodb.com/atlas,Mongo DB,DPDT- Data & GenAi,Database Software,Database as a Service (DBaaS) Providers,Usage Based,Serverless,,,,,"from 
$0.10/million reads ( Usage based)",,,,Initial Purchase,ISV/Partner
Atlas ,https://www.mongodb.com/atlas,Mongo DB,DPDT- Data & GenAi,Database Software,Database as a Service (DBaaS) Providers,Usage Based,"
Dedicated",,,,,$57/ month ,,,,,Name of existing partner
Marketing Hub,https://www.hubspot.com/products/marketing,HubSpot,SCS- Sales & Marketing,Marketing Automation Software,,Per Seat, Free,"https://www.g2.com/products/hubspot-marketing-hub/reviews
https://www.hubspot.com/pricing/marketing/
Chat GPT","Lead Generation and Management: Capture and nurture leads through targeted campaigns, forms, and landing pages, integrating with CRM systems for seamless lead management.

Email Marketing Automation: Create personalized email campaigns, automate follow-ups, and track engagement metrics to optimize email performance.

Social Media Management: Schedule posts, monitor social media interactions, and analyze performance across multiple platforms to enhance brand presence and engagement.

Content Marketing: Plan, create, and distribute content across various channels, leveraging SEO tools and analytics to improve content effectiveness and reach.

Analytics and Reporting: Measure campaign performance, track ROI, and generate detailed reports to inform strategic decisions and optimize marketing efforts.","User Licenses: Pricing often scales with the number of users accessing the platform, with different tiers offering varying levels of access and permissions.

Contacts and Database Size: Costs may vary based on the number of contacts or size of the database managed within the platform, influencing storage and processing requirements.

Feature Tiers: Different pricing levels based on the features and capabilities included, such as email marketing, social media management, and advanced automation.

Volume of Emails: Pricing can be influenced by the volume of emails sent per month or additional costs for higher email limits and sending capacities.

Add-Ons and Integrations: Additional costs may apply for integrations with third-party applications, advanced analytics, custom reporting, and premium support services.",Monthly,$0,No / Support,,,,
Marketing Hub,https://www.hubspot.com/products/marketing,HubSpot,SCS- Sales & Marketing,Marketing Automation Software,,Per Seat,Starter,,,,,$15/mo/seat,No / Support,,,,
Marketing Hub,https://www.hubspot.com/products/marketing,HubSpot,SCS- Sales & Marketing,Marketing Automation Software,,Per Seat,Professional,,,,,"$800/mo
Includes 3 seats",No / Support,,,Google Worskapce Specific Questions,Subquestions
Marketing Hub,https://www.hubspot.com/products/marketing,HubSpot,SCS- Sales & Marketing,Marketing Automation Software,,Per Seat,Enterprise,,,,,"$3,600/mo
Includes 5 seats",No / Support,,,Number of Licences,
Sales Hub,https://www.hubspot.com/pricing/sales,HubSpot,SCS- Sales & Marketing,CRM Software,,Per Seat, Free,"https://www.hubspot.com/pricing/sales
https://www.g2.com/products/hubspot-sales-hub/pricing
Chat GPT",".Personalized Outreach: Tailor outreach efforts based on detailed prospect insights, past interactions, and preferences, enhancing engagement and relationship-building.

. Predictive Analytics: Utilize data-driven insights and predictive analytics to forecast sales trends, identify potential bottlenecks, and optimize sales strategies for better outcomes.

. Sales Enablement: Equip sales teams with tools, content, and resources to effectively engage prospects at each stage of the buyer's journey, fostering confidence and competence.

. Workflow Automation: Streamline complex sales processes, automate routine tasks like lead follow-ups and contract management, and ensure consistency in sales operations.

. Integration Ecosystem: Leverage seamless integrations with marketing platforms, customer support systems, and analytics tools to create a cohesive ecosystem that enhances cross-functional collaboration and data visibility.

.",". User Licenses: Pricing often scales with the number of users accessing the Sales Hub platform, offering different tiers with varying levels of access and permissions.

. Contacts and Database Size: Costs may vary based on the number of contacts or size of the database managed within Sales Hub, influencing storage and processing requirements.

. Feature Tiers: Different pricing levels based on the features and capabilities included, such as sales automation, predictive analytics, and advanced reporting.

. Volume of Contacts: Pricing can be influenced by the volume of contacts managed or additional costs for increasing contact limits and data storage.

. Integration and Add-Ons: Additional costs may apply for integrating with third-party applications, accessing advanced analytics, customizing workflows, and obtaining premium support services.",Monthly,$0,No / Support,,,Type of Licences,Buisness/Enterprise
Sales Hub,https://www.hubspot.com/pricing/sales,HubSpot,SCS- Sales & Marketing,CRM Software,,Per Seat,Starter,,,,,$15/mo/seat,No / Support,,,Billing Cycle,Monthly/Annual
Sales Hub,https://www.hubspot.com/pricing/sales,HubSpot,SCS- Sales & Marketing,CRM Software,,Per Seat,Professional,,,,,$90/mo/seat,No / Support,,,Domain on which licences are required,
Sales Hub,https://www.hubspot.com/pricing/sales,HubSpot,SCS- Sales & Marketing,CRM Software,,Per Seat,Enterprise,,,,,$150/mo/seat,No / Support,,,Transfer Token,
Linkedin Recruiter,https://business.linkedin.com/en-in/talent-solutions/,Linkedin,DW- HRMS,Recruiting Software,Recruiting Automation Software,,Recuriter Lite,"https://www.linkedin.com/pulse/how-much-linkedin-recruiter-2024-edition-michael-kilcullen-51yge/
ChatGPT","Precision Search and Filtering: Utilize LinkedIn's advanced search filters and Boolean operators to pinpoint candidates with specific skills, experience levels, and geographic preferences, ensuring targeted recruitment efforts.

InMail Campaigns: Engage potential candidates directly through personalized InMail messages, leveraging LinkedIn's analytics to optimize message delivery and response rates.

Competitive Intelligence: Gain insights into competitor hiring trends and talent movements through LinkedIn's company insights and talent pool analysis, informing proactive recruitment strategies.

Collaborative Hiring Process: Facilitate seamless collaboration among hiring teams with LinkedIn Recruiter's shared candidate profiles, real-time feedback, and integrated scheduling tools.

Integration with ATS: Integrate LinkedIn Recruiter with your Applicant Tracking System (ATS) to streamline candidate data management, automate workflows, and ensure data consistency across recruitment stages","Seat Licenses: Pricing typically scales with the number of recruiter seats or licenses required, allowing access to LinkedIn Recruiter's tools and features.

Search and InMail Credits: Additional costs may apply for purchasing search credits to access advanced search filters and InMail credits for sending messages to candidates outside your network.

Access Levels: Different pricing tiers offer varying levels of access to candidate profiles, search functionalities, and analytics tools based on subscription plans.

Enhanced Features: Optional upgrades for enhanced features such as competitive insights, talent pool analytics, and automated candidate recommendations may incur additional costs.

Contract Length and Renewals: Discounts or incentives may be offered for longer-term commitments or renewals, providing cost savings over time.",,,,,,,
Linkedin Recruiter,https://business.linkedin.com/en-in/talent-solutions/,Linkedin,DW- HRMS,Recruiting Software,Recruiting Automation Software,,Recuriter Professional Service,,,,,,,,,Atlassian Specific Questions,Subquestions
Linkedin Recruiter,https://business.linkedin.com/en-in/talent-solutions/,Linkedin,DW- HRMS,Recruiting Software,Recruiting Automation Software,,Recuriter Corporate,,,,,,,,,Number of Licences,
Sales Engagement,https://outplayhq.com/sales-engagement-platform,Outplay,SCS- Sales & Marketing,Sales Acceleration Software,Sales Engagement Software,Per Seat,Starter,https://outplayhq.com/pricing,". Multi-Channel Outreach: Engage prospects through personalized email sequences, automated phone calls, SMS messages, and social media interactions, ensuring a diverse and effective outreach strategy.

. Cadence Management: Create and manage customized cadences of communication tailored to each prospect's journey, automating follow-ups and nurturing sequences to maintain engagement.

. Personalization at Scale: Leverage dynamic email templates and personalized messaging features to deliver relevant content based on prospect data, increasing response rates and building stronger relationships.

. Activity Tracking and Analytics: Monitor prospect interactions in real-time, track email opens, link clicks, call outcomes, and response rates to refine outreach strategies and prioritize leads effectively.

. Integration with CRM Systems: Seamlessly synchronize data between Outplay and CRM platforms like Salesforce and HubSpot, ensuring a unified view of prospect interactions and enabling streamlined follow-up actions.",". Seat Licenses: Pricing typically scales with the number of users or seats accessing Outplay, allowing sales teams to collaborate and utilize its features for outreach and engagement.

. Feature Tiers: Different pricing levels based on the features and capabilities included, such as multi-channel outreach, cadence management, and advanced analytics.

. Usage Limits: Additional costs may apply based on usage limits for email sends, call minutes, SMS messages, and other outreach activities beyond included quotas.

. Integration Requirements: Costs for integrating Outplay with CRM systems, marketing automation tools, and other platforms may vary based on the complexity and scale of integration needed.

. Support and Training: Optional packages for premium support, onboarding, and training sessions to maximize team effectiveness and adoption of Outplay's features.","Monthly, Annualy",$0,No / Support,,,Type of Licences,Standard/Enterprise
Sales Engagement,https://outplayhq.com/sales-engagement-platform,Outplay,SCS- Sales & Marketing,Sales Acceleration Software,Sales Engagement Software,Per Seat,Growth,,,,,"$99 /month /user, billed monthly
$79
/month /user, billed annually",No / Support,,,Billing Cycle,Monthly/Annual
Sales Engagement,https://outplayhq.com/sales-engagement-platform,Outplay,SCS- Sales & Marketing,Sales Acceleration Software,Sales Engagement Software,Per Seat,Enterprise,,,,,Contact sales,No / Support,,,SEN Number,
Sales Prospector,https://www.cognism.com/prospector,Cognism,SCS- Sales & Marketing,Sales Intelligence Software,,Per Seat,Platinum ,"https://www.cognism.com/pricing
","Targeted List Building for Fortune 500 Companies:  Cognism excels at providing access to a vast pool of verified contacts within large, complex organizations   This allows sales teams to build targeted prospect lists for Fortune 500 companies, focusing on specific departments or decision-makers.

Increased Connect Rates with Seamless CRM Integration:  Cognism integrates with popular CRM platforms like Salesforce and Salesloft with just a click. This streamlines outreach and ensures data consistency. By having accurate contact information and leveraging Cognism's insights, salespeople can personalize outreach for higher connect rates.

List Cleansing & Enrichment Beyond Competitors:  While competitors offer data enrichment, Cognism focuses on data quality and GDPR compliance.  This ensures your lists are up-to-date and reduces outreach bounces. Additionally, Cognism goes beyond basic enrichment, providing insights like buying committee structure and technographic data.

Identifying Multithreading Opportunities:  Cognism's data allows you to see the connections between different people within a target account . This enables you to identify ""multithreading"" opportunities, where you can approach multiple decision-makers simultaneously to increase your chances of closing a deal.

Reduced Lead List Building Time:  Sales teams spend a significant amount of time on manual research for lead generation. Cognism boasts a significant time-saving advantage  (https://www.cognism.com/case-studies), allowing you to build high-quality lead lists in a fraction of the time compared to manual methods. This frees up your salespeople to focus on outreach and closing deals.",,,,No / Support,,,Registered email id with Atlassian,
Sales Prospector,https://www.cognism.com/prospector,Cognism,SCS- Sales & Marketing,Sales Intelligence Software,,Per Seat,Diamond,,,,,,,,,,
Zohodesk,https://www.zoho.com/desk/,ZOHO,SCS- Sales & Marketing,Help Desk Software,,Per Seat,Standard,"https://www.zoho.com/desk/pricing.html
",". Customer Support Management: Organize and manage customer queries through a robust ticketing system, ensuring efficient resolution and tracking of issues.
. Automation: Implement custom workflows, macros, and rule-based automations to handle repetitive tasks, improving support efficiency.
. Multi-Channel Support: Integrate and manage customer interactions across multiple channels like email, phone, chat, and social media from a single platform.
. Analytics and Reporting: Generate comprehensive reports on support metrics, agent performance, and customer satisfaction to identify areas for improvement.
. Self-Service Portals: Create and manage knowledge bases and community forums to empower customers with self-service options, reducing support load.",,,,,,,Salesfore Specific Questions,Subquestions
Zohodesk,https://www.zoho.com/desk/,ZOHO,SCS- Sales & Marketing,Help Desk Software,,Per Seat,Professional,,,,,,,,,Number of Licences,
